authors,title,repository,article,code,data
"Wise, T., Charpentier, C. J., Dayan, P. & Mobbs, D. ",Modeling the mind of a predator: Interactive cognitive maps support flexible avoidance of dynamic threats,PsyArXiv,https://psyarxiv.com/6d4z7,https://github.com/tobywise/interactive-avoidance,https://osf.io/fwgqa/
"Tashjian, S. M., Wise, T., & Mobbs, D. ",Model-based prioritization for acquiring protection,PsyArXiv,https://psyarxiv.com/nv5u4/,-,-
"Wise, T., Michelini, G., Zbozinek, T., Hagan, C. C., & Mobbs, D",Development and validation of the Avoidance of Respiratory Viral Infection Scale (ARVIS),PsyArXiv,https://psyarxiv.com/dkc7m/,https://github.com/tobywise/arvis_development,https://github.com/tobywise/arvis_development
"Qi, S., Cross, L., Wise, T., Sui, X., O'Doherty, J., & Mobbs, D.",The Role of the Medial Prefrontal Cortex in Spatial Margin of Safety Calculations,bioRxiv,https://www.biorxiv.org/content/10.1101/2020.06.05.137075v1,-,-
"Zbozinek, T., Perez, O., Wise, T., Fanselow, M., Mobbs, D.",Ambiguity Drives Higher-Order Pavlovian Learning,PsyArXiv,https://psyarxiv.com/t2x8r/,-,-
